Comment,Emotion
i have found the perfect remedy for anyone feeling stressed or conflicted about the future its the a href http www,anger
i didnt feel insulted though,anger
i feel offended when friends especially married friends somehow judge me for not being married yet,anger
im feeling insecure and sad because i dont know what to do with my book,fear
i feel like a little kid whose mom is proud that they touched the soccer ball once during the game,joy
i am comforted knowing that i can use my gun for my protection and will not be put behind bars for using it when i feel threatened,fear
i feel about this totally and completely pissed angry sad disappointed and absolutely furious at tough mudder the biggest rip off on planet earth,anger
im feeling virtuous i do a spinach feta cranberry salad with balsamic viniagrette,joy
i seriously still feel so insecure and dreadful that the new guy would suddenly pop back up and change things,fear
i know that feeling for sure,joy
i think im just being stupid feeling nervous,fear
i feel we re seeing now is a clash between those who are very alarmed at the changes in our planet and those who are rather laconic about the whole thing,fear
i feel a remembrance of the strange by justin aryiku falls into the latter category,fear
i feel the echoes of the divine so very close,joy
i like to participate in sketch challenges from time to time when im feeling inspired,joy
in sweden,fear
i also feel aggravated i have an embarassing reason i dont want to go home yet i dreaded coming here and now im dreading leaving here,anger
i see lovers i feel envious i want someone to be there for me,anger
i feel offended and sad because they do not know their ignorance,anger
i feel she s frantic about controlling her message wary of others readings fearful of what meaning they might find and or create in her performance,fear
im feeling that kind of feeling when you are confused yet like bleh,fear
i have the feeling she was amused and delighted,joy
when it became clear that a man had used many people sexually and psychologically,anger
i feel paranoid but atleast now i get some comfort with dd she is the only person that i can talk to and not feel lie total crap around she is the nicest kindest most caring person i have ever met and i dont think that i will ever find anyone as great as her in my life,fear
i had climbed on a cherry tree alone and there was a thick caterpillar beside my fingers i feel disgusted by caterpillars and snakes i was terribly afraid of the caterpillar crawling on my fingers out of the fear i was almost unable to climb down,fear
i think it is possible maybe i am denying it maybe i am not opening myself up to the whole possibility maybe it is only just now i have realised that it is possible to give a man men that power over me to make me feel shaken in my leather sandals,fear
i feel like a person who tortured somebody because i like to see the fans confused and embarrassed at the same time,fear
i wasnt feeling well yesterday and today has been randomly busy,joy
i feel jealous when i know he go out with other women,anger
i stand by that he is actually annoying giggle i also acknowledge that i have been feeling very dissatisfied,anger
i feel invigorated by the,joy
i feel so selfish but i just want to keep my baby close for awhile and not let the rest of the world in unless i feel like it,anger
i really do feel for kids who are tortured in highschool,fear
i rid myself of many bad habits only to fall back into them when i feel insecure or vulnerable,fear
i am feeling vulnerable worrying that the publishing world doesn t like my stories and won t like this next one if i write it,fear
i feel that i was innocent i did not want to hurt anyone,joy
i feel better about myself almost tasting my success,joy
i don t like feeling vulnerable or exposing all my worries and concerns mostly because i have felt the need to hold it together to be the strong one,fear
i always feel a little shy in those situations and then nervous that my shyness is making me seem aloof,fear
i feel that the classroom is extremely dangerous,anger
im feeling festive tonight,joy
i fully enjoy music when i feel afraid using headphones,fear
i feel impatient to do a final post after four more weeks with tangible results so far its exciting to see how far the philips reaura can go in terms of firming and smoothing,anger
i feel that being faithful isnt enough in your eyes,joy
i know is that right now i feel like i am still in th grade trying to be as useful as my little legs will let me be,joy
i want to enjoy this and feel successful,joy
i created my how to paint an owl e course with the intention of sharing the simple shape templates that i use to start my own owls so that others could easily create their own and not feel afraid to start on a blank canvas,fear
i feel radiant this morning,joy
ill feel lively again,joy
i reply because they make me feel pretty,joy
i sit here tonight i m pensive tense and feeling a little fearful,fear
i tend to think that it kinda contributed to my medium intelligence and made me understand and feel things in a clever and sensible way in the visual arts field especially but i m always feeling that i m losing that more and more,joy
i spoke with reported feeling dissassociated and dissatisfied with their human lives,anger
i feel really wronged in fact what hu jia did is good for society,anger
i wonder how they would feel if someone was screaming at them and then saying horribly rude things behind their back later,anger
i have a feeling this month is going to have some damn cool things in store,joy
i feel tortured being a person because no one in the world even think im somebody i wish there will be somebody out there wishing is just a waste of time though i dream too for somebody but its just the same tortured,fear
staying alone in the biology building after the dark,fear
im feeling a little grumpy today with the lame weather tease we got over the weekend,anger
i feel glad to have my little blog to share with you the dangers i see on the path ahead,joy
i have a feeling my view isnt going to be very popular and thats fine,joy
i was feeling nervous sure just like anyone else would be in my position,fear
i also get to feel proud of my weight loss which when completed in a few months time i will have lost around kg which is approx pounds,joy
i could feel myself hit this strange foggy wall,fear
i guess i would feel more like joseph with walt trusting me to care for mother and over the finances which he did six months before he died there are times i want to defend my self but god makes me be quiet,joy
i feel the need to emphasize these things at the moment because of how grumpy i have been this last week,anger
i don t like the idea that women in the entertainment industry especially in pop music may feel pressured to turn themselves into hypersexual tartlets but i get the feeling that rihanna isn t being provocative because she feels she has to,fear
i feel the eyes on me the hateful eyes on the other side of the glass that belong to the family members of my beautiful victims,anger
i spend time dating or attempting to date only to end up feeling confused,fear
i first held my scotty i knew i was in love with my high priced bundle of joy but i couldnt help feeling apprehensive about what the time to come holds,fear
im feeling in my heart to make my list of things that i am thankful for,joy
i dont know how to explain it very well its like i am happily bobbing along exploring an abstract universe all on my own but when i make contact with something i get excited and happy and i feel satisfied like ive formed a special bond with whatever ive encountered,joy
i talk about in this essay is that people feel differently about poetry when they re angry or sad,anger
i get giddy over feeling elegant in a perfectly fitted pencil skirt,joy
i feel so special when im wearing this front,joy
i may pour out the half empty cup here i will still be making significantly less than i was making at the age of fresh out of college is an entire dollar and some change more an hour which feels like sweet desperate progress,joy
i posted this lovely picture on instagram and was feeling slightly rebellious walking on that plane feeling,anger
ive predicted angle to win and im feeling slightly less grumpy than when i wrote that lets say that gallows wins clean here to keep things tight,anger
i need nine hours but it s true and if i get less even seven hours which is supposed to be the norm and which some people consider a lot i feel grumpy unhappy and seriously unmotivated,anger
i almost feel greedy for believing that i want so much,anger
i was feeling really emotionally distraught and unable to concentrate,fear
i grabbed him by the collar and pulled him against me in a passionate tonguey kiss feeling his long member slide between my waiting ass cheeks as it pulsed on the frantic bud of my clit,fear
i feel threatened i feel fear,fear
i feel even more pressured to cook healthy meals and not eat out do thorough preschool lessons with my boys keep the house spotless exercise serve the church and community and be a happy loving wife at all times,fear
i loved a person and he went away it wasnt necessary that he left me to reach his goals,anger
i feel bitter to see what i ve become,anger
i feel soooo impatient,anger
i love how i can feel totally distressed and hopeless but when i put on a bright eyes record or something all of a sudden i have this realization that there is more to life than the shit i worry about,fear
i almost feel greedy with my rd child when so many people i know are working so hard for or,anger
i love this because to me it should leave the reader feeling confused and slightly deceived,fear
i do know the main reason i feel like i m losing myself unsure if i ll ever get those pieces back but i m not quite ready to talk about that just yet,fear
i feel so uncertain about the decade ahead,fear
i feel anxious and worry just in case i dont understand the customers problems,fear
i feel deeply and truly content,joy
im feeling rushed and like i should have planned certain things this summer that i can no longer do,anger
i feel nervous about going back to america not knowing what to expect the transition to be like,fear
i wanted both but i feel greedy,anger
i was beginning to feel fear nevertheless a stubborn person i am i swept the superstition away but i reminded myself to pay extra caution,anger
ive found it im feeling pretty pumped,joy
i feel so happily rebellious,anger
i am going to clean the slate by unilaterally forgiving those i feel have wronged me or someone i love intentionally or through carelessness so that i thereby in time can forget the perceived insults and abuses,anger
i was thinking about how you all were watching general conference and i was feeling a bit jealous,anger
i went but i did feel shaky,fear
i wanted that sacred experience to feel that divine communion with the god of my understanding i wanted to feel sublime love in sacred terms,joy
i hate feeling indecisive because im being negative right now and i dont know what i want,fear
i feel less aggravated and upset today i think i realized that its just not worth it it proved to be wasted time and effort pointless and stupid i am fine with not knowing him im uneffected for the time being at least,anger
i am feeling remarkably grumpy not to mention foolish,anger
i would like to reduce the amount of jealousy i feel god commands us not to be jealous and i feel that every jew religious or not should obey that prohibition,anger
i feel fine now but it was pretty rough running for hours and minutes straight,joy
i don t know why i feel so bashful defending it,fear
i was not feeling so nervous because she seemed so calm and collected,fear
i feels acceptable even desirable,joy
i feel optimistic that he ll settle in before too long once we ve arrived,joy
i feel afraid but i have learned to allow myself to be afraid,fear
i felt unfairly treated at an airport,anger
i feel suddenly startled catch my breath and think it could be any day,fear
i feel that we are heading for an abyss that has been created by the greedy the too greedy and the far too greedy,anger
i feel like my life is practically perfect in every way right now and i am every so happy,joy
i feel more useful,joy
i search search search and very rarely feel satisfied with the solutions found,joy
i refers of course though i cant help feeling somehow ironically in retrospect to loudons son with kate mcgarrigle the rather talented himself rufus wainwright,joy
i want to be in the future years some of you made me feel amazing and some of you are the best friends i could ever ask for,joy
i have an uncomfortable feeling that there actually was an important lesson there for me to learn,joy
i feel paranoid thinking about it just looking out the window and feeling my insomnia creep up on me,fear
i was feeling restless no one was home and it was sunny outside,fear
ive found it has made a huge difference especially on the finger with my ring and the my skin feels so much softer and less irritated,anger
i feel like the audience is smart enough and knows the characters well enough to figure out who were reading,joy
i do find myself feeling distraught about getting older and stressed about the impending responsibilities that are to ensue i am generally content with only a little bit of repressed anger that makes it s appearance only when it s instigated,fear
im still not sure why reilly feels the need to be so weird,fear
im feeling particularly generous,joy
i feel like if i ask them to stay for me then im being the selfish one even though they are the ones making plans that they know i cant do with them,anger
i feel like it but i cant i cant give in i am just to stubborn and i must win,anger
i do however feel a bit envious of people who have different perfumes for different seasons,anger
i am feeling brave we will go somewhere further afield like a walk in the woodlands around a farm to the beach or some other full day activity,joy
ive grown as a mother and treasure my role in this family now whereas i used to second guess myself a lot and feel very unsure of my maternal skills,fear
i start feeling myself getting overwhelmed or frustrated i have tried to open up more about it instead of pushing it down deep slapping on a fake smile and waiting until i boil over,fear
i think its the case that whether people like anne coulter or ed schultz really feel as outraged as they do their viewers most certainly do feel that kind of outrage and anger about the substance of their collective tirades,anger
i have eaten at many restaurants and feel that we enjoy the cheaper but much more delicious eateries than these more elegant but lacking in spice and flavor places,joy
i feel convinced plus so many diverse price tags that i feel sure everyone should come up with the funds to have their plot to be lighted up relatively economically,joy
i continue to spend hrs into not feeling envious can i really do it,anger
i feel extremely mind fucked,anger
i feel like i should be thrilled and i am but at the same time i feel like crap,joy
i feel insulted video pete edochie responds to death hoax i feel insulted a href http olajideolafunmbi,anger
i will continue to feel disgusted every time i accidentally catch a glimpse of myself in the mirror or see the results of an impromptu picture,anger
i was at the cinema with my sister and her boyfriend a man sitting beside me started to stroke my leg for a while,fear
i just smile because it feels rude not to do so if you make eye contact i also can t really help myself,anger
i want to say that i feel vulnerable writing and sharing this info,fear
i remember feeling acutely distressed for a few days,fear
i haven t yet experienced the totality of this is that i am getting to use my gifts again without feeling like someone is threatened jealous or competing against me,fear
i can sleep on the couch or on the floor if you are still feeling shaken he offers gently,fear
i feel so cluster fucked in my head,anger
i am also not a perfect girl friend and im always a disappointment always feeling so doubtful and always putting you through a hard time with my mood swings and sudden outburst of low emo mood,fear
i felt like i had went so far now it feels like my world was shaken just the other day,fear
i dont expect reilly will mess them up and since we have no cats i feel pretty safe leaving them in place,joy
i feel however that this administration is so dangerous i have no moral choice but to speak,anger
i admit i was feeling agitated so when hubby asked me if i want to join them for a drink i agreed,anger
i am feeling so excited for many of the bloggers i follow who are anxiously bearing through a ww of the first few weeks of pregnancy,joy
i feel a sense of loss when an extremely talented and passionate engineer who wants to work on certain dsp design eventually takes up a job at a financial number crunching software company only because he did not get the right kind of job,joy
i feel they are the last of the tortured fandoms remaining save saints football fans but thats the wrong sport,anger
i feel like trusting the driver,joy
i feel this book explains things well and is easy to use,joy
i feel like i should continue with the bridge lessons since continuity is going to be vital if i m to learn this game,joy
i try and try to keep up with other bloggers and read whats scheduled so that my review goes up close to when everyone elses does but im tired of feeling rushed tired of the pressure that i put upon myself,anger
i won t get into making excuses for the man he s a big boy and can do that for himself and his staff i walked away from red rooster feeling dissatisfied underwhelmed and confused,anger
im feeling a lil restless about axel,fear
i feel kinda apprehensive,fear
i cant really understand my feeling cause its a mixture between bitter and a sour one which even i dont get,anger
i feel very socially anxious around these ladies,fear
i trust he has a plan and if i stay true to and listen to the promptings in my heart i feel assured that everything will be okay and will be worked out for his plan,joy
i feel cranky already,anger
i don t feel insulted because it doesn t sound insulting at all,anger
i shall never feel like i am less than a valued human but i will always know that my needs can and will be met by gods people if i get rid of my pride and ask,joy
i think that our favorite activities as a child are often very telling and if someone is feeling a little unsure about their life s direction going back to those childhood favorite past times holds many rich clues,fear
im feeling stubborn today and got home and was like no way im gonna go get that mri soon,anger
i am feeling optimistic about doing as much as possible in the next to hours before the kids come home,joy
i feel like the legality of our marriage is in tatters thanks to all the hateful lies and messaging from the prop campaign,anger
i feel i am seeing a series of intelligent people who have compartmentalised science and religion mostly into separate areas of their minds and not all in the same way and they are flicking backing and forth between them like radio dials,joy
i reached the halfway point of the climb and my arms were feeling good but god dam my right leg was tired,joy
im currently feeling cranky for silly reasons im now going to complain,anger
a study visit to a chicken factory the butchery,anger
i feel quietly ecstatic over the painless change in our grocery expense,joy
i feel like i totally fucked up,anger
i drove us to the car parts place and terry feels like im safe to drive again so yippee,joy
i am just so sick of feeling hated and lonely and dumb and unloved and forgotten,anger
i feel like this project will actually help me pick a valuable car that is decent looking as well as efficient to my everyday use,joy
im doing things that make me feel brave and strong i have a a href http derfwadmanor,joy
ive got a feeling she will be just like her momma stubborn strong willed amp full of tx sassiness,anger
i feel that cold breeze,anger
i vividly remember feeling so offended that she would even dream such a thing could be a choice,anger
i feel a mad connection with your body and this is how i decided to kick off side a,anger
i guess ive been feeling agitated lately,anger
i feel like ive been in a more innocent version of a one night stand,joy
i feel like im not as stubborn,anger
im feeling very frustrated with my novel in progress right now and i cant even decide why,anger
i would like to know why duke university administrators feel that it is acceptable to readmit collin finnerty news story jan,joy
when i was ten i got shut in the school with a friend i had to jump out of a window and cross a beam metres high,fear
i feel guilt from inaction and spend much of my time helping and supporting others,joy
i will write anything if i feel passionate about it or at the very least if it genuinely interests me,joy
i felt rich being able to insist on paying more than the asking price the shop assistant was obviously pleased at being able to boost the takings for the charity and i hope the generous person who donated the easel to the shop is also feeling rich,joy
i feel all rushed to get ready for tomorrow,anger
i feel like i was actually productive today,joy
im feeling especially honored as my picks feature alongside some of my favorite designers like diane von furstenberg rodarte and jason wu,joy
i feel a little less fearful about it,fear
i have a feeling my mom wont be so keen on that idea,joy
i said in the words of a devotee that i feel relieved when i hear the your title as deen bandhu as i am the most fallen person but i become afraid at your title of uplifter of devotees as i don t consider myself to be a true devotee and hence unworthy to benefit from the aspect of your personality,joy
im feeling so irritable about todays class,anger
im really really sad that i missed the menswear show because i feel like its worth supporting this venture to show more menswear,joy
i feel like in some ways im probably not putting myself in vulnerable positions enough and pushing the limits of it,fear
i worked thought that it was a good reason to either feel pity for me disgusted at me or more rarely intrigued by me and that was a class of people i didn t care to talk to,anger
i feel pretty weird blogging about deodorant but im a bit of a deodorant snob and find it really hard to find a good one,fear
i get these intrusive thoughts mostly violent ones or sometimes sexual the sexual ones make me feel really agitated not pleasant at all whereas the violent ones don t tend to bother me,fear
i didnt think i was angry but now that im typing away feeling my words evaporate into cyberspace i am very pissed that this is happening,anger
i feel so annoyed,anger
i truly felt that when i left friday you were smiling and feeling i had respected you and you thinking i was a teasing little heathen you loved who enjoys arousing you with an animal delight,joy
i cant stop talking even though im already feel weird uncomfortable feeling swarming me but still my mouth keeps saying unnecessary word,fear
im trying to be intuitive often just makes me feel sort of confused and nauseous,fear
i feel about putting on brave faces fuck that let s get real,joy
im feeling a bit bitchy tonight so i will be,anger
im going to be talking a bit about how i feel about the important role of the fan in this wonderful game we call music,joy
i quickly learned just by moving from sauna to ice cold bath to steam room to shower until you feel like a tortured goldilocks who wants nothing more than to find the middle ground between too hot and too cold,fear
im not only thankful that everything seems to be working out as i wrap week at my new job but also feeling pretty lucky to have the people we do in our lives,joy
i feel flirty playful sexy reckless,joy
i feel is truthful the fun always lies in having an idea and seeing it realized and not soo much in the object or goal,joy
im not yet feeling terrified of failing i honestly feel like im overconfident right now because i believe that ive done my best,fear
i keep coming back to it but it feels awfully selfish of me to feel this low this negative when there are so many in far worse positions than i,anger
i say his name over and over and feel the change in him the nearly violent desire he reigns in with difficulty as the first waves of orgasmic stupor envelops me,anger
i thought breaking up with my best friend of years would make me bitter and feel hateful towards her,anger
i feel utterly disgusted that they would look at me in such a way but the thing continues,anger
i feel so doubtful about myself ever since i took this job,fear
i feel for the people who dont see its worth or are too afraid to discover it,fear
i had to lose my best friends to be with the one who can make me feel forever contented with life and be eternally happy,joy
i feel angered by this,anger
i asked zack if i could go all out and write what i was feeling and he was gracious enough to let me do so,joy
i feel quite scared about my work life balance if i start to work for ken again,fear
i feel totally carefree with them around,joy
i meet in supermarkets banks dentists etc make me feel like im weird,fear
im feeling a bit cranky today,anger
i feel the cold more than him,anger
im feeling abit uncertain now,fear
i feel more confident about this team right now than i did four hours ago,joy
i can use these moments as an opportunity to feel that radiant beautiful soul that has been hidden for so long behind those walls,joy
i am already feeling like i am being less productive,joy
i complete the act i feel temporarily satisfied but the feeling quickly goes away and i feel ashamed or guilty,joy
i always spend more money there than i mean to and feel dissatisfied when i exit the store,anger
