Comment,Emotion
i purposely put that statement in the negative to show that im now feeling gun shy,fear
i have a feeling might have offended one of the dorks sitting in the censorship cubicle of doom,anger
i think the main benefit here is that it wets the surface giving even the earliest strokes something to play against and it also helps get my ass into the deep end of the pool if i am feeling hesitant about where to begin,fear
i feel bitter theofilou said of the lack of support to nods of agreement by kastrioti who waited for her turn to board,anger
i feel like i ve fucked up massively for not being able to fight off being suicidal,anger
i feel really tranquil where i am right now,joy
i admittedly feel like crap and want to sleep all day and am so cranky i just want to yell at everyone,anger
i feel when i just out from my dorm and began to breath a pleased liberty,joy
i do feel a shift in me to being more positive,joy
i think since im compelled to act all meek and asian in front of my own kind i feel a tad inhibited to the extent that i cant even be myself,fear
i wonder does anyone ever feel particularly inspired or moved watching question time these days,joy
i didnt feel that welcomed when i first entered morris quickly changed that and i left feeling very happy,joy
i feel pretty relieved and psyched that they actually got to see something penn said as members of the production team sifted through the mounds of trash pulling out boxes games and other atari products,joy
i feel that she should change herself and i was too timid to speak up for her except in underground murmurs,fear
i feel frustrated sometimes with my mac lipsticks when i have to read names or open each of them to select shade,anger
i can listen to it and feel dissatisfied,anger
i feel very giggly and upbeat even though i feel like i should probably be morose and sombre,joy
i do not know these people since they are not a resident of this room and for them to treat me in such a way that i feel angered,anger
i suppose in some ways i should feel irritated that if she knew why didn t she do anything to help me with this lone cause i was feeling,anger
i feel so pissed off over an old friend and some friends,anger
i can t stop thinking about it i feel paranoid like they re judging me i know they re probably now but i just feel that way,fear
i think maybe about how strongly she feels about him and being there for him but brad looks really distracted,anger
i would not feel hesitant in using the medical system again if needed,fear
ive been feeling so restless at home these days probably because i had been cooped up at school and home for way too long,fear
i started to feel cold,anger
i feel hesitant unsure doubtful of myself,fear
i feel selfish and self indulgent,anger
i feel i had to make as a hateful bastard is too stupid to make any assumed connections that are not themselves hateful,anger
ive been hearing about too many things happening back i singapore and it gets me feeling irritated and depressed about not being able to be there,anger
i would feel strange describing it but if anyone is interested let me know and i will add it,fear
i feel it s a worthwhile cause and hope you decide to participate,joy
i feel that now i am a lot less irritable than i was before,anger
i feel uncertain about,fear
im sure that the folks in virginia florida and the other handful of swing states agree feel not only put upon but insulted by the constant barrage,anger
ive to admit im feeling excited yet so unprepared for the surgery,joy
i feel like we are a creative home truly painting while they are in there making music,joy
ill let you in on a few more huge dieting secrets just because im feeling very festive and giving right now,joy
i reach for your hand feel its warmth sense a strange mysterious connection the greater sea of lives intimately shared and buoyed by a wave of love hope and joy surrender to its greater transcendent surge letting it take me wherever it will,fear
i feel pressured and can not move on to other items in our wedding checklists,fear
i even get jealous when my bf speaks to his best friend who is a girl and also friend of mine but i listen and understand their friendship because my trust towards my bf is higher than me feeling jealous,anger
i need to tell someone how i feel you are gorgeous,joy
i think its kind of taken us this long to build up a good inventory of sauces oils spices and other non perishables to feel like we have a chance at making something delicious without having to specifically go out and buy every single item in a recipe,joy
i feel pretty jolly,joy
im under a lot of stress and feeling overwhelmed,fear
i actually feel solidarity with the americans who went on to cry for blood in iraq tortured prisoners and the stripping of the bill of rights,fear
i feel frustrated lonely or am having a hard time i think of elf and regain my strength lets spend together you guys and the other member for sure,anger
i said i wanted to give you a little sample of the writing i denied you then but i m feeling a little more generous today i suppose because i just have to share one little taste,joy
i would estimate that when i speak nepali i feel about as intelligent as when i speak english with german i feel about as intelligent and with spanish i feel about as intelligent,joy
on a boat trip to denmark,joy
i feel like it was a bit rushed,anger
i feel yet you are so heartless and go for the men that will break your heart,anger
i didn t ride on sunday and was still feeling a little apprehensive on monday so decided to a title lunge href http en,fear
i am feeling so much love for my own mother and appreciative of all that she has done for me,joy
i express the gene of this dominant voice it feels rather wonderful as if i were really this writer this poet who was so carefree and crazy,joy
im making more mistakes thinking less clearly and feeling more anxious,fear
i feel very distressed because i m supportive of this campaign and with the senator,fear
i do feel a bit obnoxious it is definately the weather,anger
i t want t know f t habitual t feel frightened wh n initiation r career,fear
i am feeling so festive today that i m even going to put the tree up as soon as i ve finished doing this and catching up with the week s goings ons on coronation street,joy
i didnt expected to be that much addicted to the nicotine before ive experienced all withdrawal symptoms feeling irritable and so stressed going mad with cravings inability to concentrate dry mouth trouble sleeping i wake up every night at a,anger
i asked feeling hesitant,fear
i go fishing i really feel so carefree can i fish everyday,joy
im feeling the need to mellow out i find something on the ipod that suits me or when im ready to pump it up ive always got a go to tune or two to get me reved up,joy
i inspect samples of wheat i started feeling that i was a suspicious character,fear
i feel delicious absolutely darling and delicious,joy
i proclaim to have lost a bit of my sanity and feel so shaky,fear
i even feel strange if i forget a primer and put foundation on my bare skin,fear
i brush it to the side or tuck it behind my ear only to feel a few rebellious strands escape and tickle my cheeks and my lips i realize im not the one in control,anger
i was able to maintain physical and mental activity as well as have a necessary structure and routine without feeling pressured to overdo it,fear
im shocked i feel my own little problems put into perspective and i feel heartache for the innocent lives that have been ended,joy
im feeling terribly impatient,anger
i feel like im in such a strange place in life no one to take care of and no one who cares,fear
i feel restless otherwise known as useless or lazy when i take long breaks from writing,fear
i feel intimidated by your question,fear
i know the feeling will fade away in a day or two or even in a few hours when the cute hairstyle starts to droop and frizz,joy
i feel is glamorous will be shared there,joy
i realised i only hate people because i feel threatened by them,fear
i never thought i could feel thankful for such an awful thing but i am for making me stronger even as my husband gets weaker,joy
i just don t feel like having distraught parents breathing down my neck,fear
i was feeling so indecisive and blah,fear
i want to exhibit all new pieces which is kinda making things a bit more stressful but i know id feel somewhat dissatisfied about showing old work,anger
i can t take medication because its triggering i have to be really at the point of i can t stand what i m feeling anymore just so i can get past that barrier but medicine has me afraid of vomiting,fear
i feel ecstatic because no more homework,joy
i often refer to myself as being weak im not sure what i mean exactly when i say it but i do know that when i reflect on the past two years i feel strong strong and accomplished,joy
i of britain so were louis xvi and marie antoinette but i think perhaps i feel the loss of russia more because it was so violent it was the entire family and because it was so comparatively recent,anger
i feel pretty officer krupke and somewhere,joy
i feel resentful about being a giver,anger
i am not feeling particularly creative,joy
i feel like im a hateful person sometimes,anger
i know that im carrying an obvious prejudice into all of this because of my own feelings about watching them be repeatedly tortured on this topic,anger
i could feel the radiant heat of emanating from her naked sex reaching longingly for the probing tip of my hardness,joy
i have kept quiet when someone did or said something hurtful and not said what i was feeling because i did not want to be rude,anger
i imagine you re going to come away from it feeling a little jealous you can t quite,anger
i feel really overwhelmed with mine,fear
i feel about him and how he affects me and people around me this is my story i have been trying for years to find a way back to the life i had before being in a long and very violent relationship,anger
i feel that entertainers as talented as williams become part of our lives,joy
i feel the language of the warning is pretty benign but i am open to your suggestions on how to improve it,joy
i was feeling kind of hesitant about food which sucked because we were going out to dinner that night followed by drinking,fear
i feel like i have to preface this post w a disclaimer of some sort before i have an enraged peta after me or something equally as horrible,anger
i feel that there is something valuable about herzog s study particularly as it relates to the idea of art and media influencing society and culture,joy
i feel afraid to write because there are so many thoughts that need to come out,fear
i think you said beautiful things to them and i think you meant them you loved being with them i think you made them feel terrific,joy
i need that warmth to remind me hes there when life feels cold and empty,anger
i bag qaf look who s cryin now jacynthe lookin good feelin gorgeous rupaul the skins scissor sisters valentine the sun fed up kayle who s your daddy gerling awake the unkind u,joy
i feel like todays sweet treat would be something served at the north pole,joy
im still feeling a bit grouchy,anger
i look at myself and feel dissatisfied,anger
i think is i told my dad and now he feels skeptical about us,fear
i simply can t help but feel dissatisfied after reading glancing through each,anger
i was still feeling strong,joy
i think i wake up every day feeling terrified in some way but then i feel totally exhilirated when facing things i ve always been scared to do,fear
i feel more energetic than i have in years,joy
i feel honored by it,joy
i feel like a heartless b tch for hating him so much,anger
i feel like thats a pretty petty thing to complain about,anger
i could listen for hours without feeling either threatened or the slightest bit shocked,fear
i feel angry man named muaz,anger
im feeling less hateful of fandom,anger
i feel honored or insulted,joy
id pop out of the chair feeling like i should be doing something more worthwhile,joy
i feel pleased that i will resist it till i get these next four night shifts over with,joy
i feel contented staying grounded and take it slow as i build up the little things that comes my way,joy
i feel christmas more special than ever,joy
i woke up feeling alarmed,fear
i feel this violence is petty and impractical,anger
i feel anxious about a coming event or activity that will require physical energy that i may not have or emotional events that will require emotional energy i look to my parent and adult to take charge,fear
im off to the big city solo for what im afraid is going to be six days of wandering around lost six days of feeling uncomfortable six days of not knowing how to dress six days of not knowing what to do six days of not knowing where to eat six days of disaster disaster disaster,fear
i am so incredibly thankful for the temple and for the blessings the promises and especially the feeling that comes over me when i am either inside this amazing building or simply when i drive by,joy
i woke up feeling grumpy tired unhappy and just plain sick of things,anger
i do i feel like i just make him mad or upset and he doesn t talk to me,anger
i didnt really want to talk about it with anyone because its kind of selfish and i feel that id rather ignore it than to be selfish about it,anger
i feel more relaxed now that i will get good care and that i need to accept advice given to me unless i feel very strongly otherwise,joy
i feel like he counted my letter as one supporting the current status quo which to say the least is not what i stated,joy
i feel so mad i feel so angry i feel so callous so lost confused again i feel so cheap so used unfaithful let s start over let s start over let s start over,anger
i try not to complain or show them my attacks because they feel so helpless like any parent would,fear
i feel terrific and i m starting to put weight on,joy
i feel like shes just so distracted but when it comes to my year old brother she waits on him hand and foot,anger
i are another reason why foreign tourists feel reluctant to drive in this island,fear
i just couldnt shake the feeling that he is being left out somehow and i sort of hated that i had done this to him,anger
i want to be swept off my feet and feel special rather than just being told i am,joy
i feel very suspicious of all of them,fear
i am feeling very smug as i am continuing my resolution to use up some of this huge paper stack that i own and never cut into so heres the latest offering using more of my graphic curtain call papers,joy
i feel so incredibly graceful and sexy in this pose i have to say,joy
i always feel quite smart when wearing this,joy
im feeling really annoyed,anger
i knew from high school and he s pretty fuckin chill says that the girl feels insulted and threatened by the blog that i wrote and would like me to apologize and if i offended her i m sorry,anger
i was feeling frustrated at work wondering if i am living a life with meaning and purpose,anger
i may feel uncomfortable or just want to give up,fear
i never actually felt the sense of suspense springer was obviously trying to build with references to religious programming in that there was nothing there in the book to build suspense with nothing i could see that made me feel uptight worried or anxious about any of the characters,fear
i got a feel that the actors were very physically talented and skilled at presentational acting but had done little to no research into the backgrounds of their characters or that of wilder,joy
i was down and feeling doubtful,fear
i feel about puppy mills puppy mills are run by greedy people who do not care about the quality of life for animals,anger
i returned home feeling invigorated and wanting more,joy
i love my job and know that the surgeries were doing are emergencies i always feel resentful especially when it is am and i was sleeping,anger
i might be afraid to leave the house to nurse in public to commit to a social engagement or to wear anything that makes me look worse than i already feel so in honor of fearless friday i invite our newbie mom readers to do something that scares them,joy
no description,anger
i do love life and i do love to laugh and i enjoy the funny side of things because honestly if i dont look at the funny side of things i would spend the majority of my life feeling pissed off over the stupid things that people do,anger
i feel inspired and eager to press on when the sun shines,joy
i feel as if i m one of the stubborn ones,anger
i only feel frightened and these are such small things,fear
i feel paranoid when i wear makeup out,fear
i feel satisfied with it,joy
im feeling you up grumpy,anger
i feel so uncertain all i did was crying over the phone saying i cant finish the reading,fear
i have certainly been in places where i did not feel welcomed and i made a point to go on to a place where i did find that feeling of welcoming,joy
i read too much about discovery and exploration in the wild west and while i feel that those concepts are precious taking part in them often myself this book just brings a refined feel when i sit back in the chair for some quiet time,joy
i focus on the injustice the anger rises and i feel frustrated because i know i cannot change things on my own,anger
i have also always been afraid of the cold pool but i realized that it actually doesn t feel cold after about laps,anger
im feeling inspired by all the summery elements of my favorite past time beach bummin,joy
i really dont feel very sociable in that bar anymore,joy
i must say though i have been feeling pretty violent,anger
i feel i just couldn t be bothered with some of the things that used to keep me up at night,anger
i feel really wonderful about myself and love the life i live,joy
i am known for letting things go when im not feeling good,joy
im postponing feeling virtuous about this labor,joy
i have essentially at least in my mind solved these design problems i just don t fucking feel like working them out in all their iterations i just feel like i can t be bothered leave that shit to the junior designers,anger
i feel this product deserves a positive review i do want to leave you with a somewhat contradictory final thought,joy
i feel wronged by you over and over,anger
i woke up feeling shaky and nauseous with lots of cramping and pressure in my abdomen and pelvis,fear
i am feeling incredibly restless,fear
ill admit it im bitchy sometimes but i feel as time goes by im getting more bitchy with him than my other relationships that went past the month mark,anger
i feel all glamorous,joy
i feel like a snob but i ve been a bit skeptical of it from the start because i have no idea who kenny werner is and neither does thomas a musician who gave me the book,fear
i kept staring at her quivering flower feeling that it was like a violent flower in time lapse photography a flower shivering with vigorous growth as it accelerated out to the flickering sun racing sky heralding the end of our relationship before it had even started,anger
i have been feeling very insincere,anger
i was feeling pretty hateful towards my refrigerator as i cleaned it,anger
i try to come up with ideas that i feel are clever to keep the my pieces fun to make and interesting to look at,joy
when my mother kept me in leadingstrings,anger
i was feeling very keen to get out of the camp site before they realised i had been given the best gift of all free accommodation and free services,joy
im feeling bouncy enough and if i can rustle up some people keen to go with me,joy
i feel that phrase implies a calm orderly procession in which i would remove the refuse from my,joy
i didnt feel there was anything special about it,joy
i would not knowingly wound the feelings of any not even one who may have wronged me but would seek to do him good and make him my friend,anger
i love the feeling of running in the cold when you can see your breath and cold air seems to refresh you from the inside out,anger
i wanted to go and ask him about my batting but was feeling hesitant about approaching such a big player,fear
i am feeling a little nervous and anxious but never second guessing my decision,fear
i detest feeling uncertain,fear
i actually feel frightened of people here right now,fear
i feel as though i don t write about them often enough but they are just cruising through life in their own equally special ways,joy
i was feeling paranoid tonight so i had to check my blog stats,fear
i managed a whole tuesday of eating clean but have caffeined up today and am feeling rather shaky,fear
i think it affects me so much because it results back to one of my biggest flaws which is not feeling enough pretty enough smart enough you name it,joy
i have not spent that much time with them but i just don t feel that comfortable there,joy
i am sometimes confused as well for a moment in a time of need when the day to pay a bill has come and we dont have the money we need i sometimes feel confused as well,fear
i should go to sleep but i m feeling reluctant to let go of the day,fear
i feel pressured helpless because i dont have control over this,fear
ive been feeling reluctant intermittent and lacklustre to pen my thoughts down,fear
i am in front of a blank canvas i feel calm and focused,joy
i am i cant help but feel skeptical about the whole thing,fear
i did feel slightly shaky and had a headache,fear
i don t know if he knew about buffy but i for one was feeling nervous about how the whole multiple dogs on a flight thing was going to pan out,fear
i have the dried bladders all ready for a day im feeling brave,joy
i feel more clever,joy
i feel very apprehensive to adopt labels and to even identify myself as queer it seems that im still quite unclear on that subject and it keeps me feeling separate from the queer community like joel,fear
i feel uptight my day is complete when hes around i feel so right a little nervs i dream about what we can do date and all the things we can pursue wedding i always dream that your mine very day min,fear
im sorry this apparently offends a lot of other women because its only women who feel the need to say something rude but im going to do it anyway,anger
i know ive talked about this before and i know that eric has talked about how the same thing happened on his mission just how like sometimes you feel like you get super overwhelmed by all the stuff you have to do and its just so easy to be really hard on yourself the mental game if you will,joy
i had a very provocative dream the kind that makes you feel slightly shaken as you wake up from it,fear
i feel still very honoured and i am deeply thankful that i was granted this opportunity,joy
i was feeling a bit annoyed but it didnt really affect me very much,anger
i am feeling grumpy i put this on,anger
i headed there fully expecting them to have been sold out ages ago and that i would find myself staggering back upstairs without them feeling all bitter twisted and disappointed but at least with some of the allocated pennies still lurking in my own bank account,anger
im feeling suitably annoyed by the panel and its time to get you a recipe for these previously deemed unworthy treats,anger
i feel poisoned and tortured by this room,fear
i thought he was just the type that doesn t show his feelings i laughed and convinced myself that i don t know what s happening beyond closed doors so who am i to make conclusions,joy
i began to feel bitter towards them,anger
i get a little twitchy when i feel like someone is depending on me and i have to have a flawless job done in the end,joy
i do not feel that i could ever harm an innocent girl in such a way never have i imagined such dire consequences for not doing so,joy
i feel hateful sometimes,anger
i started feeling festive a little early this year,joy
i like to pull out when i ever i feel like being snobbish about my musical tastes,anger
im going to sleep now while i still feel triumphant,joy
im kind of feeling nervous and anxious about all the shit i have to do today,fear
i was feeling very vulnerable and down no one really close to me has ever died before i either hadnt known them very well or was too young to remember,fear
i dont know what mediation means to everyone else but to me this process only has value if i freely express how i feel and as this will inevitably leave me feeling vulnerable and exposed the longer the delay the more i can feel anxiety building,fear
i feel spiteful toward him,anger
i feel glad that justice will be served west said,joy
i also feel like i was being way too irritable today,anger
i dont think he is being honest with me about a lot of things i could be wrong here but i keep feeling skeptical about certain things after everytime i hang out with him,fear
i always feel that it is profoundly worthwhile,joy
i suppose we had these moments of feeling vulnerable together and we laughed a lot and i felt very alive,fear
ive been frustrated that i dont walk around floating on air seeing the good in every sidewalk pothole i trip into beating myself up over feeling unsure and scared,fear
i still feel like the admission that i don t like this popular show puts me in a category with people who kick puppies or people who or who steal the ratty clothes off the backs of dickensian orphans,joy
i feel really nervous about losing it i print the file out on to paper as a final security,fear
i lets me into his fucked up world and he usually does i feel fucked up too and honestly a little scared,anger
i feel vulnerable and alone,fear
i feel so honoured to have hosted this series to have such talented a,joy
i feel that it is dangerous to portray angels as walking the earth and intermarrying with humans,anger
i feel rebellious a little annoyed mad caged in,anger
i feel everything is in control then i am ok,joy
i have an overwhelming feeling of sadness that there are people in this world that are so hateful,anger
