Comment,Emotion
i think most people have little problem expressing but once in a while i can t help but feel that we shouldn t be afraid to let it all hang out there and express the other emotions that don t get nearly as much airtime,fear
i know what i believe and how i feel but some part of me is still hesitant because the old me would have said that anyone who believed there was a god was crazy,fear
i sometimes feel so vulnerable and so lost,fear
i feel uncertain if the most of similar families can be reached the uncertainty does not preclude us from serving those we can in the meantime while discovering the ways to reach the others,fear
i am saying that i am feeling helpless now that i have to walk on toes,fear
i feel like someone s strange uncle trying to break the ice at a party by showing this amazing talent thinking that guests will be impressed but in turn just made everything a hundred times more awkward,fear
i always had a feeling of being in shape and became increasingly frustrated with the daily accumulation of body fat elusive,anger
i do feel amused by all the different debates going on but on the other hand i felt that theres something missing,joy
i feel like i can breath now and not be so rushed,anger
i lived her life without the feeling of acceptance she felt as though trouble and misery followed her everywhere she went and that everyone hated her because of it,anger
im still feeling a little shaky as i write this post,fear
ive been feeling restless in my career,fear
i give probably to the degree that some might see as too much but if i feel taken advantage of or wronged in any sense i have absolutely no problem shutting it down and walking away,anger
im feeling irritated by her friggin name,anger
i was a child i stole rmb from my grandfather maternal and i feel i exceptionally wronged him,anger
im feeling queezy and cant be bothered putting these in order so here goes,anger
i feel like a dangerous animal as i prowl out of the jungle and onto the warm sand of this deserted island,anger
i know it signifies him feeling not dangerous secure and relaxed so i don t guess it is causing him any undue stress,anger
i look back and i feel so incredibly satisfied with my life refreshed ready for my next adventure,joy
i remember feeling so hellip furious with the shooter,anger
i do not want to accept that it s inevitable that we all become grumpy old men and women as we age and i do not want to accept that feeling irritated and annoyed by trivial little things is normal,anger
i feel i should probably move on to the meat of my story before i get too distracted by the side dishes what happened to good music,anger
i get nothing and i really want to feel like if someone likes me for who i am not for my stubborn sister,anger
i reached down to feel what that strange sensation was and i felt something there,fear
ill smoke a few cigarettes because im feeling a little nervous,fear
i am feeling increasingly hopeful,joy
i don t a feel like an idiot and b not get illogically mad at people for going to bed too early sorry for the anger family,anger
im feeling rather impatient with these rainbows bursting in my veins,anger
id be more use at that level which would make the job feel more worthwhile and the season is basically half as long,joy
i male are stupid first for woman cry babies and should get over it and you feel really cool for putting the stupid men in their place,joy
i feel disgusted c kj rel bookmark class permalink nov middot,anger
i guess the trick is i need to go in strong and get what i want and not feel bashful over it,fear
i do not feel frantic,fear
i feel like a total bitchy person today yay,anger
i always plant a big section of lettuce and i leave it open for those pesky bunnies so that they can feel all rebellious as if they are raiding my garden,anger
i was feeling very unsure as to whether or not i should continue to blog at all,fear
i haven t been able to shake this akward and unusual feeling i feel irritable and space out all the time feels like i was surged as well as my computer,anger
i am now drunk again and feel fab,joy
i am feeling a little uncertain as i am waiting to hear from my land lady to confirm a date and receive my contract,fear
i feel strange coming back to work after my one day holiday,fear
i feel so lucky to have the opportunity to be here,joy
i was escorting a relative on a bike,fear
im not necessarily sure what but something in the education system must change or students can feel anxiety and pressure with needing to be flawless with their vast knowledge of the world,joy
i needed to feel rebellious,anger
i didnt tell you because i didnt want you to feel afraid,fear
i do not feel comfortable staying in my house i feel relentless when im asked to do something tired almost all the time and bored without my own money,joy
i may not be rich by material standards but i feel very rich because i am grateful for what i have,joy
im also feeling cranky about it because the main characters scientist brother observing the moon mentions that there is zero gravity there,anger
i did feel a little less inhibited in class tonight,fear
i am suddenly feeling very energetic,joy
i was a bit more bouncier than usual i didnt feel as grouchy about everything as normal,anger
i think i can finally articulate it the prius is in its own shiny happy al gore wearing patagonia in alaska way somewhat insidious in that it makes driving feel like a virtuous act,joy
im feeling irritable and sick,anger
i came home one day and discovered that my sister had borrowed my car and had gotten into an accident with it my entire front bumper was destroyed,anger
i feel somewhat alarmed,fear
i have written but you feel the need to point out that someone somewhere could be offended if they were to read my words out of context knowing nothing about me and after having a really bad day do not bother to inform me of this,anger
i was left feeling bothered by it for a long time afterwards,anger
i feel like this could be a dangerous topic if anyone feels passionately about pianos but its been on my mind for a while and i thought it was worth discussing not because im going to paint my piano which i grew up with so please stop hyperventilating mom,anger
i know its easy to twist things to create an explanation and im still not sure i have one but it did help me to feel a little less mad,anger
i feel very dissatisfied with myself,anger
i cough alot more and feel somewhat irritable at times,anger
i feel like this concert was much more successful than the previous one,joy
i feel strange and weird about this entire struggle am i the only one who deals with this kind of conflict,fear
i got inside it was so warm compared to the outside temp that my survivor man skills kicked in and i stripped down to my base layers to avoid feeling cold when i got back outside,anger
im feeling at my creative best rather than that of a student who has a deadline to meet,joy
ive been feeling a little frantic recently because our summer together is flying by so quickly,fear
i mean geez cara was raised not to feel compassion she had all love and feeling tortured and beaten from her at a very young age thats how the mord sith work,anger
i am sharing information that i feel is important to personal safety and empowerment parenting and living well,joy
i try to remember that quote when i feel i may be hitting a wall in a marathon or even a training run and i know it is time to find that perfect song that fuel,joy
i am feeling a little adventurous so i will try to see if we can spook our pretty lady,joy
i was just randomly talking about it and how i found the once more with feeling cd and listened to it and was quite eager to watch the show again,joy
i met people from every corner of the globe so now when i am feeling restless and my finances will allow me i am can pick a spot see people that i really care about and have an adventure with them in their homelands,fear
i can do to that would truly express the utter gratitude and thankfulness i feel for your sincere gesture and i am very grateful,joy
i feel scared rather than curl up like a threatened porcupine,fear
i feel no matter how convinced i am that i am all alone on this life journey of mine i am not alone,joy
i am writing this i remember between feeling assured i wasnt dead and checking the window that me and my mom started fighting,joy
i left to the shower questioning what i feel she was gorgeous such a fantastic body so confident in her movement effortlessly graceful,joy
i feel intimidated like i just want to turn around and head back into the safety of my yoga class or hop on the tried and trusty treadmill,fear
i write and share my feelings family events useful products good food exciting trips kitchen endeavors as well as occasional musings,joy
i this feels rebellious to me,anger
i remember a totally different feel having been a faithful dukes watcher growing up,joy
im feeling confused but ill keep trudging through,fear
i got my eyebrows waxed the other day and i feel glamorous,joy
i seriously feel uncomfortable,fear
i have learnt nothing else in the last two years it is that it s best to feel my way by trusting my instincts,joy
i will not go into details from that long night but i woke up for our am bus feeling like i could barely stand and not trusting the pit in my stomach,joy
im creature of feelings i evaluate life on my feelings dangerous,anger
i kept feeling enraged that she was in too,anger
i feel a bit hesitant about the whole thing given my past two experiences and the fact that i m going to start a new novel while i work on my current wip because i feel like it would be cheating to count the words on my current wip even though i m only about words into it,fear
i wanted to not feel frightened anymore,fear
i can stop feeling jealous,anger
ive been feeling very indecisive lately,fear
i didnt even have time to feel jealous i was so busy pinning her pictures and writing down a href http nanashi,anger
i feel suspicious but i cant walk a way i like him i always had a thing for football players i know ive been m,fear
i was feeling anything but adventurous and stuck with comfort zone and ordered mcdonalds,joy
i feel it rarely advances any worthwhile cause and i always stick to the rule of not posting anything online that i wouldnt be prepared to say to somebodys face,joy
i remember waking up feeling anxious and excited to read the bible its amazing how god will change your desires,fear
i feel like im in a really strange stage of my life right now as im entering my th year,fear
i suddenly feel anxious im crying over little things,fear
i was also feeling anxious around some of the people sitting in the waiting area,fear
i feel like i m in some weird limbo between childhood and adulthood,fear
i havent gotten them yet because i still resent paying dollars for a procedure that wasnt fully successful and since i wore glasses for years i feel ive been tortured enough,anger
i just remember feeling so much pain and being confused and scared and convinced that i could not do this,fear
i like her too much to feel as if im being obnoxious and getting involved into somethign that has nothing to do with me,anger
i began to feel that it was shaken so badly that it would never be repaired,fear
my roommate was rude to me,anger
i feel pleased about this issue there are a lot of beautiful pieces in it for example maggie lees poem titled a href http vol,joy
im feeling slightly irritable but generally level headed and actually not in a bad mood,anger
i was feeling a little like a cold was coming on,anger
i have so much to be thankful for so to feel jealous of a skinny girl with a seemingly disposable income who is shopping at the mall seems so,anger
i am feeling very shaky today,fear
i seem to wake up every day recently feeling immensely irritable and i cant quite work out why,anger
i tend to stop breathing when i m feeling stressed,anger
i remember feeling frantic at this point,fear
im happy to have this in my kitchen but it feels like someone rushed this out and cut corners,anger
i just feel strongly that i cannot condone violent methods to achieve a political goal,anger
i like listening to hardcore sxe music its the one thing that lets me feel rebellious while not chocolating out or spending till its gone,anger
i try to only buy fabrics that i would use in a project or that i feel are really fab,joy
i feel i am determined to regain my routine i once had and of which i was so proud,joy
i feel really disgusted with myself more than the pain and agony,anger
ive been feeling far from perfect in the area of motherhood,joy
i recall seeing leaves falling off a tree set against a grey sky and feeling absolutely terrified,fear
i feel like i want to be very very rebellious until they regret of what they have done to their single daughter,anger
i feel as though ive reached a point in my career where im highly respected there,joy
i absolutely love this skinny fiber it is doing wonders for me and i feel fabulous,joy
i already feel the atmosphere around it seems dangerous,anger
i have an ironic feel i dont feel anything special but i still smile broadly whenever he tells me something,joy
i mean i could literally feel him feeling content,joy
when my grandmother came to stay with us permanently as she is a very difficult person to stay with and when she started telling false stories about us to other people,anger
i feel safe to leave my house in the morning,joy
i was feeling like a beluga whale and quite grouchy,anger
when i was attacked by a teenage boy and had my wallet stolen,fear
i feel smart telling people i like wally lamb because hes actually not chick lit so i always mention him so people will respect me more,joy
when we stayed in vienna with our class,fear
i feel like being distracted,anger
i can t fit in in beirut where i have the nagging feeling that i m in a heartless place,anger
i was feeling extremely anxious,fear
i feel paranoid like we just stepped into a private club where everyone knows each other and we are standing out like nudists at a suit convention,fear
i feel im back to being that bouncy little chickie i was when i first found the scene but with a lot more depth and understanding of myself and the world around me,joy
i mean already as a parent from the moment the iolani left my body i can tell you i feel like im constantly fearful for something horrible happening to her thats out of my control,fear
im not feeling insecure this month im feeling full of oomph,fear
i need her and offers valuable constructive advice when i feel unsure or negative about my writing,fear
i feel quite rebellious actually,anger
i probably love a handful of friends too but i always feel a bit strange when describing this as love,fear
i could feel this way but i honestly believe that he was and is a very violent and dangerous man,anger
i went through the exam i could feel my heart sink with each unsure answer each flip flop decision and random guess,fear
i do however feel myself feeling a bit reluctant,fear
i can also song write without feeling all bashful about it and play music and my guitars without anyone telling me to turn it down,fear
i do and it is really starting to make me feel really distraught and upset all the time,fear
i feel anxious for myself moment of truth i feel rather like a tiger in a cage when it comes to testing,fear
i keep feeling weird sensations img src http s,fear
i just feel more vulnerable than other people,fear
i feel stressed out i have to learn a lot and i cannot give my blog and looks the time i wish i could,anger
i feel like im actually supporting myself by making use of what i know and love,joy
i do i really do think i have some justification for feeling smug,joy
i get to pursue things that spark my curiosity and make me feel useful,joy
i think all acts of unkindness are a result of some form of selfishness because being unkind requires a lack of concern for the another person and some distorted feeling of gain by being unkind,anger
i just hope we can help him feel less afraid and more supported and loved,fear
i believe that what was displayed is a deep emotional yearning for semblance of normality peace since it appears the dancing arabs did not feel threatened by a fully armed soldier,fear
i am feeling brave and lucky kind of like my heart is breaking and im falling in love all at the same time,joy
i feel that is why she suddenly got mad at mom,anger
i could be feeling this way from the cold medicine ive been taking for this chest sinus cold,anger
i have an uneasy feeling about the stupidly talented eagles mainly because as good as they are at most positions they re dangerously thin at others,joy
i me still feeling cold from the swim which doesnt really count as one earlier on,anger
i feel kind of talented right now lol hmmm,joy
i feel for the guy because i think he is sincere honest and intelligent,joy
i felt a very distinct feeling that told me everything would be ok and that all things would ultimately turnout for my good,joy
i feel like im so enraged,anger
im starting to feel wryly amused at the banal comedy of errors my life is turning into,joy
i am lost distraught and mainly at a state of feeling helpless,fear
i feel bitter and jealous,anger
im already feeling stressed about salvaging the friendship as time goes by i realize theres also another point that isnt helping,anger
i refuse to rate the book but if she and her publisher feel snobbish then take it from me when i say jeanette winterson cannot write and essentially does not do wish to do anything with the scope to explore,anger
i didn t know it was possible to feel more terrified,fear
i know i feel personally offended by this on so many levels,anger
i could at least count it i didnt feel as frantic while the group followed the bird as it moved north through the trees,fear
i do not feel like a child and yet i could see myself giving into that carefree way of lestat,joy
i feel so fucking rebellious all the rules and its so regimented like if class starts at theyre taking roll at,anger
i feel i am kinda pissed off,anger
i sat on a windy beach feeling thoroughly annoyed i vowed id be back and i would climb scafell,anger
i feel very excited for my familys future,joy
i had no idea i was giving off this vibe but i feel like this is a pretty dangerous vibe to be giving off all willy nilly,anger
i am feeling particularly annoyed at my co workers i sometimes make the rounds of the floors finding literally pounds of white paper in the trash,anger
i feel that this is neither impatient nor dickish and here are some reasons why,anger
i once told my friends that i feel like doing some sort of backpacking but instead of supporting me with this idea all i got from them were raised eye brows and some sarcastic remarks,joy
i have to admit that i feel skeptical about making these changes and wonder are natural sweeteners any better for your body than refined sugars or are all sugars the same in the end,fear
i left that appointment feeling really bummed that the option of a vbac had been snatched from me but also sort of content with the fact that i had prayed for and possibly received a sign of gods will for this birth,joy
i wish that my family and i didnt feel this need to keep her constantly entertained when shes around because shes always bored out of her mind irregardless of what we do with her and doesnt remotely appreciate our efforts to tolerate everything about her but whatever,joy
i just naturally feel like i m a better player,joy
i wrote it feels slightly strange starting to write this about cambodia as i sit in lax airport waiting to bi,fear
i feel so vulnerable i need to have a mask on to go into the world or if my desire is caused by a need to divert attention or cover up weakness i should probably be making more constructive use of my time than trying to look pretty,fear
i went to registration passed an uneventful five minutes feeling deeply amused,joy
i remember feeling how my husband felt when i would see people being rude to my mom and mom just being her sweet self to them,anger
i love doing kim kardashion make up tutorials i always feel so glamorous with all that make up on,joy
i learned to feel the clay and its limits the artistic expression became more important than the mastery of the material,joy
i was sleep was vey irritable and feeling paranoid because i work the oncology dpt of a hospital and feeling paranoiud cancer and through chemo,fear
i can remember feeling petrified,fear
i feel a little uncertain about the structure of a revalidation portfolio,fear
i began the day feeling intimidated courthouses are designed to intimidate but ended the day cheerfully chatting with the judge in his chambers,fear
i also feel strongly about supporting the local economy so for the past years i am proud to have driven gm cars in a gm community,joy
im sure this silly little blog is ridiculous but sometimes i just feel so aggravated,anger
i just love the feeling of something warmly hugging you and feeling so precious and small precious to someone something,joy
i feel myself being very indecisive about how i see my work life playing out,fear
i feel it is too dangerous to invest in such markets,anger
i leave them i feel invigorated,joy
i saw i had a direct message dm on twitter from a former friend jeff who i no longer feel friendly toward,joy
i bring these to mind and feel the joyful laughter well up within my heart it becomes hard to remain weighed down by the heavier negative feelings,joy
i am feeling quite anxious about it all,fear
i can honestly say that every good thing in my life right now is crashing down and i feel too stubborn to ask for help,anger
i set off feeling strangely nervous and quite weak but slowly worked through the problems and was soon attempting the toughest problems,fear
i feel more self assured but more than that i feel whole,joy
i felt doubtful and the image that popped into my mind was of dealing with a big knot in my shoelace and then feeling frustrated,anger
i feel like it is conor at his most sincere,joy
i did the yelling the feeling of being extremely mad,anger
i can think of to quit are not based on my own needs and wants but those of others scars make other people feel uncomfortable self injury makes friends feel like they aren t offering enough support cutting is something sad teenagers do,fear
i must have been feeling a little cranky about the,anger
i feel like its important to vote on all of the local stuff,joy
i feel like i get more and more frantic with no clue which way to turn what direction my life is going or if i should even care,fear
i feel so honored to call rex dingler a friend,joy
i felt this coming on and i didn t do anything about it no it s the p docs fault because i mentioned feeling irritable at our last appointment and he didn t do anything about it,anger
im still feeling shaky i realized that i felt intolerably hot all the time which i may mention is the polar opposite of what i normally feel like,fear
i feel indecisive it feels like the security that i usually feel from sensing the ground beneath my feet is suddenly gone and i am left feeling wobbly and unhappy,fear
i feel my mom is simply feeling greedy is the lack of this reaction when her mom left the same type of will,anger
i feel your pulse against my lips as i chase the dragon suck your lips and is your heart and tongue wish begging for my part and fingers translate your sorrow as you reach inside my soul angered in my breath of mercy the story will no unfold,anger
i feel like life is too good to be true,joy
i guess i just need to see how it goes so while im feeling very nervous im also very excited,fear
i just feel like i havent shaken it up lately,fear
i strongly feel that at this point in my life i am no longer desiring to walk this path that i am on and to be truthful i have no clue as to where i am going with my life from here,joy
i like to listen to it when the weather gets warm though because it makes me feel like i m carefree and at the beach,joy
i trust my kids however i feel helpless enough in here over so many things and i m upset at the lack of respect for the few little things i asked them not to do,fear
i didnt feel much maybe just a sting but i was terrified because i didnt know if it was going to hurt or not if there would be a problem and if he knew what he was doing really who does in this situation,fear
i don t feel like i m being pressured to do anything and i don t feel like making love to my husband has any connection to the assaults and rapes,fear
i feel that i have to justify this behavior to you my faithful blog reader,joy
i needed a plan on how to get rid of that feeling it was totally taking over everything i am totally distracted at work with everything i m trying to do in any free time i have in the evenings the projects are taking over my life and the fact that i totally feel burnt out by it all,anger
im starting to feel overwhelmed again when it comes to the research for this book,fear
i start to feel more and more frantic and rushed trying to provide excellent care for my patients and then high tail it home,fear
i feel generally dissatisfied and lost,anger
i can no longer wear my t shirts without feeling like i m supporting a totally different band,joy
i feel violent wanna kill someone anyone or kiss them,anger
i sense this is wat has let you feeling unsure,fear
i am not working out the amount i would like to i feel like my lifestyle change has been successful so far,joy
i am waiting for a feeling that special feeling that makes life easy and bearable,joy
i was feeling extremely agitated after coming home from china,fear
i feel ok and go out into the world to work buy food or just go for a walk,joy
i miss the way he made me feel im at a point now where ive accepted that he betrayed me and i can never go back to him,joy
i feel a timid six other times a wise sixty six,fear
